{
  "schemaVersion": "hds-state/v1",
  "updatedAt": "2026-10-06T14:32:45.603Z",
  "workflowState": "handed-off",
  "currentFocus": "delivery",
  "confidence": 0.8,
  "activeSlice": null,
  "lastKnownGoodRevision": "b807113aba58a8252a04ebf5fc1abd2fd99fdcc6",
  "nextSafeAction": "Create a handoff or plan the next slice.",
  "blockers": [],
  "openQuestions": [],
  "gates": {
    "project-validate": "passed"
  },
  "lastHandoff": "docs/hafez/handoffs/2026-10-06T14-32-45-602Z.md"
}
